<?xml version="1.0" encoding="UTF-8"?>
<trashCans xmlns:xs="http://www.w3.org/2001/XMLSchema-instance"
           xs:noNamespaceSchemaLocation="greenBin.xsd">
    <trashCan id="1">
        <lieu>
            <adresse>Avenue Habib Bourguiba</adresse>
            <coordonnees>
                <latitude>34.740</latitude>
                <longitude>10.760</longitude>
            </coordonnees>
        </lieu>
        <typeDechet>plastique</typeDechet>
        <status>vide</status>
    </trashCan>

    <trashCan id="2">
        <lieu>
            <adresse>Sfax Medina</adresse>
            <coordonnees>
                <latitude>34.742</latitude>
                <longitude>10.760</longitude>
            </coordonnees>
        </lieu>
        <typeDechet>plastique</typeDechet>
        <status>moitie</status>
    </trashCan>

    <trashCan id="3">
        <lieu>
            <adresse>Sfax Port</adresse>
            <coordonnees>
                <latitude>34.731</latitude>
                <longitude>10.770</longitude>
            </coordonnees>
        </lieu>
        <typeDechet>plastique</typeDechet>
        <status>vide</status>
    </trashCan>

    <trashCan id="4">
        <lieu>
            <adresse>Avenue Majida Boulila</adresse>
            <coordonnees>
                <latitude>34.741</latitude>
                <longitude>10.752</longitude>
            </coordonnees>
        </lieu>
        <typeDechet>plastique</typeDechet>
        <status>pleine</status>
    </trashCan>

    <trashCan id="5">
        <lieu>
            <adresse>Rue Ali Belhouane</adresse>
            <coordonnees>
                <latitude>34.739</latitude>
                <longitude>10.766</longitude>
            </coordonnees>
        </lieu>
        <typeDechet>plastique</typeDechet>
        <status>moitie</status>
    </trashCan>

    <trashCan id="6">
        <lieu>
            <adresse>Bab Jebli</adresse>
            <coordonnees>
                <latitude>34.743</latitude>
                <longitude>10.758</longitude>
            </coordonnees>
        </lieu>
        <typeDechet>plastique</typeDechet>
        <status>vide</status>
    </trashCan>

    <trashCan id="7">
        <lieu>
            <adresse>Sakiet Ezzit</adresse>
            <coordonnees>
                <latitude>34.771</latitude>
                <longitude>10.740</longitude>
            </coordonnees>
        </lieu>
        <typeDechet>plastique</typeDechet>
        <status>moitie</status>
    </trashCan>

    <trashCan id="8">
        <lieu>
            <adresse>Sakiet Eddaier</adresse>
            <coordonnees>
                <latitude>34.757</latitude>
                <longitude>10.800</longitude>
            </coordonnees>
        </lieu>
        <typeDechet>plastique</typeDechet>
        <status>pleine</status>
    </trashCan>

    <trashCan id="9">
        <lieu>
            <adresse>Route Taniour</adresse>
            <coordonnees>
                <latitude>34.735</latitude>
                <longitude>10.780</longitude>
            </coordonnees>
        </lieu>
        <typeDechet>plastique</typeDechet>
        <status>vide</status>
    </trashCan>

    <trashCan id="10">
        <lieu>
            <adresse>Route Gremda</adresse>
            <coordonnees>
                <latitude>34.730</latitude>
                <longitude>10.750</longitude>
            </coordonnees>
        </lieu>
        <typeDechet>plastique</typeDechet>
        <status>moitie</status>
    </trashCan>

</trashCans>


           <!--    <trashCan id="1">  id: key 
        <lieu>
            <adresse>123 Rue Principale</adresse>
            <coordonnees>
                <latitude>36.8065</latitude>
                <longitude>10.1815</longitude>
            </coordonnees>
        </lieu>
        <typeDechet>plastique</typeDechet>  Plastique, Papier, Verre 
        <status>vide</status> < Vide, Moitié Plein 
    </trashCan>
    <trashCan id="2">  id: key 
        <lieu>
            <adresse>Sakiet Eddaier</adresse>
            <coordonnees>
                <latitude>34.757</latitude>
                <longitude>10.800</longitude>
            </coordonnees>
        </lieu>
        <typeDechet>verre</typeDechet>  Plastique, Papier, Verre 
        <status>vide</status>  Vide, Moitié Plein 
    </trashCan>
</trashCans>

  { id: 1, name: 'Avenue Habib Bourguiba', lat: 34.740, lng: 10.760, status: 'full' },
  { id: 2, name: 'Sfax Medina', lat: 34.742, lng: 10.760, status: 'half' },
  { id: 3, name: 'Sfax Port', lat: 34.731, lng: 10.770, status: 'empty' },
  { id: 4, name: 'Avenue Majida Boulila', lat: 34.741, lng: 10.752, status: 'full' },
  { id: 5, name: 'Rue Ali Belhouane', lat: 34.739, lng: 10.766, status: 'half' },
  { id: 6, name: 'Bab Jebli', lat: 34.743, lng: 10.758, status: 'empty' },
  { id: 7, name: 'Sakiet Ezzit', lat: 34.771, lng: 10.740, status: 'half' },
  { id: 8, name: 'Sakiet Eddaier', lat: 34.757, lng: 10.800, status: 'full' },
  { id: 9, name: 'Route Taniour', lat: 34.735, lng: 10.780, status: 'empty' },
  { id: 10, name: 'Route Gremda', lat: 34.730, lng: 10.750, status: 'half' },
-->